1442,A57D-3A05F840F619,Aguilar Ortega  F.  Charcas Salazar  H.   Aguirre Rivera  J. R.   & Flores Flores  J. L. (2024). Evolución reciente del aprovechamiento del acuífero Rioverde  San Luis Potosí  México. Interciencia: Revista de Ciencia y Tecnología de América  49(2)  85-93.
1443,91D7-34FF3F297B62,Art. Gutiérrez Escajeda  María Teresa; Medellín-Milán  Pedro; Ávila Galarza  Alfredo; Morales Aguilar  José Socorro; Chavira Martínez  Manuel Armando (2019). Contribución de los subsectores manufactureros en la variación de las emisiones de CO2 por el uso 
1444,91D7-34FF3F297B62,S. Rodríguez-Gómez  N.A. Medellin-Castillo  I. Herrera-Orozco y A. Ávila-Galarza  Análisis del ciclo de vida de una planta de tratamiento de aguas residuales (PTAR) en el estado de San Luis Potosí  México. En el V Congreso Nacional de Tecnologías y Ciencia
1445,91D7-34FF3F297B62,Claudia Nalleli Hernández Cerda  Alfredo Ávila Galarza  Miguel Aguilar Robledo y Valente Vázquez Solís. Movilidad urbana dentro de los ODS 2030. Alcances y retos en México a 10 años del término de su vigencia. Resúmenes de las ponencias en extenso del 3er.
1446,91D7-34FF3F297B62,Art. Hernández Cerda  C. N.  Ávila Galarza  A.  Aguilar Robledo  M.  & Vázquez Solís  V. (2023). Análisis espacial de las dinámicas de movilidad en la Zona Metropolitana de San Luis Potosí. Revista: Estudios Demográficos y Urbanos. Vol. 38  Núm. 2 (113)  m
1447,91D7-34FF3F297B62,Art. Hernández Cerda  C.  Ávila Galarza  A.  Cerda Alonso  D. (2023). El impacto de la movilidad urbana a la calidad del aire de la Zona Metropolitana de San Luis Potosí?. Revista de Ciencias Ambientales. Tropical Journal of Environmental Sciences. No. 57(
1448,91D7-34FF3F297B62,Art. López-Díaz  N.L.  Durán-García H.M.  Álvarez-Fuentes  G.  Ávila-Galarza  A.  Pulido Delgado  J.L.  Barajas-Beltrán  M. del S. (Marzo-Abril  2023). Cuantificación del biogás generado en tres sitios de disposición final del Estado de San Luis Potosí  Mé
1449,91D7-34FF3F297B62,Art. Sanjuana Rodríguez Gomez  Nahum Andrés Medellín Castillo  Israel Herrera Orozco  Alfredo Ávila Galarza  Sergio Arturo Castro Larragoitia  Miguel Mauricio Aguilera Flores  Verónica Ávila Vázquez. (2023). Life Cycle Assessment of a wastewater treatment 
1450,91D7-34FF3F297B62,Capitulo de libro en revisión. Claudia Yazmín Ortega Montoya  Alfredo Avila Galarza. (2024). Título del capítulo: Urban waste and GHG emission. Electricity Generation from Biogas in a Mexican municipality. Facultad de Ciencias Biológicas  de la Universidad
1451,8B55-2FD9C2CDB9DB,González-Fernández L A  N A Medellín-Castillo  R Ocampo-Pérez  H Hernández-Mendoza  M S Berber-Mendoza  C Aldama-Aguilera. 2021. Equilibrium and kinetic modelling of triclosan adsorption on Single-Walled Carbon Nanotubes  Journal of Environmental Chemical 
1452,8B55-2FD9C2CDB9DB,Cisneros-Ontiveros  H.G.  Medellín-Castillo  N.A.  Aldama-Aguilera  C. Ilizaliturri-Hernández  C. A. Cruz-Briano  S. A.  Labrada-Delgado  G. J.  Flores-Rojas  A. I. 2022. Optimization of synthesis variables and characterization of devilfish bone chars for 
1453,897E-6AC4FB573B57,Artículo científico indexado: Rios-Valenciana E.E.  Moreno-Perlín T.  Briones-Gallardo R.  Sierra-Alvarez R.; Celis L.B. (2023) The key role of biogenic arsenic sulfides in the removal of soluble arsenic and propagation of arsenic mineralizing communities.
1454,897E-6AC4FB573B57,Artículo científico indexado: Martínez-Toledo A.  González-Mille D.J.  Briones-Gallardo R.  Carrizalez-Yañez L  Martínez-Montoya J.F.  Mejía-Saavedra J.J.  Ilizaliturri-Hernández C.A. (2023) Functioning of semi-arid soils under long-term mining activity wi
1455,897E-6AC4FB573B57,Artículo científico indexado: Briones-Gallardo R.  González-Muñoz M.  García-Bautista I.  Valdes-Lozano D.  Toledano-Thompson T.  Polanco-Lugo E. Rivera-Madrid R.  Valdez-Ojeda R. (2022) Hydrogen sulfide production with a microbial consortium isolated from
1456,897E-6AC4FB573B57,Artículo científico indexado: Escot-Espinoza VM  Ramos-Arroyo YR  Lázaro I  Montes-Avila I  Carrizalez-Yañez L  Briones-Gallardo R. (2021) Presence of Arsenic in Potential Sources of Drinking Water Supply Located in a Mineralized and Mined Area of the Sier
1457,897E-6AC4FB573B57,Artículo científico indexado: Briones-Gallardo R.  González-Muñoz M.  García-Bautista I.  Valdes-Lozano D.  Toledano-Thompson T.  Polanco-Lugo E. Rivera-Madrid R.  Valdez-Ojeda R. (2022) Hydrogen sulfide production with a microbial consortium isolated from
1458,9D58-CCD553319E8A,Precipitation stripping of V(V) as a novel approach for the preparation of two-dimensional transition metal vanadates  María Guadalupe Sánchez-Loredo  Paul Chekhonin  Doreen Ebert  Ulrike Fischer  Xu Liu  Robert Möckel  Gladis Judith Labrada-Delgado  Stefa
1459,9D58-CCD553319E8A,Nanostructured Pd/Ag/Ni electrocatalysts for the Hydrogen Evolution Reaction  R. Medina-Orta  E.M. Ortega  V. Pérez-Herranz  M.G. Sánchez-Loredo  Materials Today Communications 38 (2024) 108354  https://doi.org/10.1016/j.mtcomm.2024.108354
1460,9D58-CCD553319E8A,Preparation of volborthite by a facile synthetic chemical solvent extraction method  María Guadalupe Sánchez-Loredo  Salvador Antonio Palomares-Sánchez  Gladis Judith Labrada-Delgado  Toni Helbig  Paul Chekhonin  Doreen Ebert  Robert Möckel  Jones Owusu Af
1461,9D58-CCD553319E8A,Bactericide activity of cellulose acetate/silver nanoparticles asymmetric membranes: Surfaces and porous structures role  Ana Sofia Figueiredo  Ana Maria Ferraria  Ana Maria Botelho do Rego  Silvia Monteiro  Ricardo Santos  Miguel Minhalma  María Guadalupe
1462,9D58-CCD553319E8A,Synthesis of gold nanoparticles and incorporation to a porous nickel electrode to improve its catalytic performance towards the Hydrogen Evolution Reaction  Ramiro Medina-Orta  Gladis J. Labrada-Delgado  Héctor G. Silva-Pereyra  Emma María Ortega  Valentín
1463,BCAC-3E414E812BA6,Biochemical evaluation of the remediation of weathered and contaminated soil with heavy metals. Ángeles Martínez-Toledo  Guillermo Espinosa-Reyes  Donaji J. Gonzalez-Mille  Eleno U. SanJuan-Meza  César A. Ilizaliturri-Hernandez. 2024. Journal of Soils and 
1464,BCAC-3E414E812BA6,Functioning of semi-arid soils under long-term mining activity with trace elements at high concentrations. Ángeles Martínez-Toledo  Donaji J. González-Mille  Roberto Briones-Gallardo  Leticia Carrizalez-Yañez  Juan Felipe Martínez-Montoya  José de Jesús Me
1465,BCAC-3E414E812BA6,Evaluation of in situ biosurfactant production by inoculum of P. putida and nutrient addition for the removal of polycyclic aromatic hydrocarbons from aged oil-polluted soil. Ángeles Martínez-Toledo  María del Carmen Cuevas-Díaz  Oswaldo Guzmán-López Jaime
1466,8676-9B08C03A43C0,García-Garnica R.  Castillo-Magallanes N.  Rodríguez I.  Cruz R.  Lázaro I. (2022) Electrochemical study of enargite within the mixed potential zone attained with different oxidizing reagents in an alkaline medium  Electrochimica Acta  425: 140719. ISSN:00
1467,8676-9B08C03A43C0,Rodríguez J. E.  Razo I.  Lázaro I. (2023) Water footprint for mining process: A proposed method to improve water management in mining operations  Cleaner and Responsible consumption  8:100094. ISSN:2666-7843. 
1469,8676-9B08C03A43C0,Arait Montoya  Juan L. Reyes  Iván A. Reyes  Roel Cruz  Isabel Lázaro  Israel Rodríguez (2023)  Effect of sodium hypochlorite as a depressant for copper species in Cu-Mo flotation separation  Minerals Engineering  201:108166 .
1470,8676-9B08C03A43C0,Néstor Castillo-Magallanes  Israel Rodríguez  Roel Cruz  Isabel Lázaro (2023) An EIS study of the effects of inorganic salts in the adsorption of flotation reagents on galena  Journal of Solid State Electrochemistry  27: 3029-3040
1471,8676-9B08C03A43C0,Arait Montoya  Iván Reyes  Roel Cruz  Isabel Lázaro  Néstor Castillo-Magallanes  Rogelio Flores  Israel Rodríguez (2024)  Evaluation of disodium carboxymethyl trithiocarbonate as a depressant reagent for chalcocite: An electrochemical approach  Minerals En
1472,9FEF-FEB0A53EA59D,Artículo científico: Rosa A. Martínez Esquivel  Mariana García de la Torre  José S. Fernández Reyes  Marcos Algara Siller  Claudia Corpus Espinosa  Denisse L. González Villacis  Nancy L. Pérez Ramos  Verne J. Martínez Guzmán  Gerardo Morales Jasso  Ximena 
1473,898F-BF42CA1693A8,Artículo revista indexada: Wang  F.  Loria  A.  Ramos-Arroyo  Y.R.  Rocha  D.  Cruz-Jiménez  G.  Razo-Soto. I.  Alfaro de la Torre  M.C.  Armstrong  D. and Guerrero. S. 2022. Widespread elevated concentrations of gaseous elemental mercury in Guanajuato  Me
1474,A5A7-43F2C26C43A5,Verma  S. K.  Torres-Sánchez  D.  Sandoval-Espinel  L. C.  Hernández-Martínez  K. R.  Shukla  M.  Torres-Sánchez  S. A.  Torres-Hernadez  J.R.  Lopéz-Loera & Zandomeni  P. S. (2023). Geochemistry  petrogenesis  and tectonic setting of the Cúcamo mafic and 
1475,A5A7-43F2C26C43A5,Vázquez-Vázquez  L. L.  García-Zaleta  D. S.  Torres-Sánchez  S. A.  López-Martínez  S.  Hernández-Nuñez  E.  Zurita-Macias-Valadez  M.  & Morales-Bautista  C. M. (2023). Variability of the components of oil drilling waste according to the treatment temper
1476,A5A7-43F2C26C43A5,Torres Sánchez  S. A.  Jenchen  U.  Augustsson  C.  Barboza Gudiño  J. R.  Martínez Hernández  K. R.  Ruiz Mendoza  V.  & Torres Hernández  R. (2023). Grafito en el complejo metamórfico paleozoico esquisto granjeno. Actas de la Facultad de Ciencias de la T
1477,A5A7-43F2C26C43A5,Verma  S. K.  Torres-Sánchez  D.  de León Hernández  D. A.  Oliveira  E. P.  Hernández-Martínez  K. R.  Torres-Sánchez  S. A.  & Malviya  V. P. (2022). Petrogenesis and geodynamic implications of Oligocene A-type granite in the Guadalcazar area  San Luis P
1478,A5A7-43F2C26C43A5,Yzquierdo-Ruíz  M. M.  Torres-Sánchez  S. A.  De la Garza-Rodríguez  I. M.  Ojeda-Morales  M. E.  Hernández-Nuñez  E.  Lobato-García  C. E.  & Zurita-Macias-Valadez  M. Pre-evaluation of contaminated soil for oil field reactivation in Moloacan  Veracruz  M
1479,A5A7-43F2C26C43A5,Ocampo-Díaz  Y. Z. E.  Augustsson  C.  Guerrero-Suastegui  M.  De Alba  J. A.  Barboza-Gudiño  J. R.  Martínez-Paco  M.  & Torres-Sánchez  S. A. (2022). A wave to tidal influenced deltaic coastline in a carbonate environment: The Late Jurassic to Early Cre
1480,A5A7-43F2C26C43A5,Méndez-Moreno  J. D. C.  Garza-Rodríguez  I. M.  Torres-Sánchez  S. A.  Jiménez-Pérez  N. D. C.  Sánchez-Lombardo  I.  López-Martínez  S.  & Morales-Bautista  C. M. (2021). Changes in restored soils subject to weathering and their implication in Mexican en
1481,9FEF-FEB0A53EA59D,Director de tesis de maestría. Mares Jasso  M.A (2021). Propuesta para el manejo integral del agua en escuelas públicas. Caso: Escuela Francisco González Bocanegra  La Pila  S.L.P. Maestría en Tecnología y Gestión del Agua. Maestría en Tecnología y Gestión
1482,9FEF-FEB0A53EA59D,Director de tesis de maestría. Torres Martínez  G. (2021). Análisis de los elementos de sostenibilidad en la Política Pública de México para una propuesta de programas de escuelas sostenibles. Maestría en Ciencias Ambientales. Maestría Programa Multidiscip
1483,9FEF-FEB0A53EA59D,Director de tesis de maestría. Fernández Reyes  J. S.(2021). Strategic assessment of an on-campus energy system: The University energy program of UASLP  Mexico. Maestría en Ciencias Ambientales. Maestría Programa Multidisciplinario de Posgrado en Ciencias 
1484,9FEF-FEB0A53EA59D,Director de tesis de maestría. Martínez Guzmán  V. J. (2021). Proposal for a food security program: the urban agriculture guideline at the Autonomous University of San Luis Potosi. Maestría en Ciencias Ambientales. Maestría Programa Multidisciplinario de P
1485,9FEF-FEB0A53EA59D,Director de tesis de maestría: Carrillo-Amaneyro  José María (2022). Life cycle assessment as a tool for waste management. A case study of a composting heat recovery system as an energy alternative for Germany and Mexico?. Programa Multidisciplinario de Po
1486,9FEF-FEB0A53EA59D,Director de tesis de maestría: Andrade-Rivera  Juan (2023). Proposal for an urban green infraestructure management strategy based on ecosystem services. Programa Multidisciplinario de Posgrado en Ciencias Ambientales  ENREM  UASLP. Examen: 28 de agosto de 
1487,9FEF-FEB0A53EA59D,Director de tesis de maestría: Mine  Emily Carol (2023). Application of lean management strategies to improve the performance of a university integrated solid waste management program. Programa Multidisciplinario de Posgrado en Ciencias Ambientales  ENREM 
1488,9FEF-FEB0A53EA59D,Memorias en extenso. ? González-Pereyra  D.  Cisneros-Almazán  R.  Berber-Mendoza  M.  Soto-Peña  G.  Cisneros-Pérez  R. y Algara-Siller  M. Abril 2020. Humedales construidos para el tratamiento de aguas residuales de la industria del electroplating. En V 
1489,9FEF-FEB0A53EA59D,Memorias en extenso. ? López Vázquez  V. H.  Aguilar-Rivera  N.  Algara Siller  M. e Ibarra-Zapata  E.  2010  Análisis de riesgo de dispersión de roya anaranjada (Puccinia kuehnni) a través del modelo Hysplit  XIV International SELPER?s Symposium  8 ? 12 d
1490,9FEF-FEB0A53EA59D,Memorias en extenso. ? Algara Siller  M.  López Vázquez  V. H. y Olvera Vargas  L. A.  2010  Plataforma informática para la vigilancia epidemiológica fitosanitaria en México  XIV International SELPER?s Symposium  8 ? 12 de noviembre 2010  pp. 12. ISBN: 978
1491,9FEF-FEB0A53EA59D,Artículo científico.  Campos-Delgado  D.  Ramos-Palacios  C. R.  Cisneros-Vidales  A. A. y Algara. 2023. Possible scenarios for a micro-watershed based on level of urbanization: using flood design to advance ecohydrological principles. Urban Science 2023 7
1492,9FEF-FEB0A53EA59D,Artículo científico.   Hernández-DeTorres  J.  Ávila-Montoya  C.  Lastras-Martínez  L. F.  Lastras-Martínez  A.  Flores-Jiménez  D. E.  Cárdenas-Tristán  A. y Algara-Siller  M. 2023. Remote sensing of atmospheric nitrogen dioxide in an urban area in centra
1493,9FEF-FEB0A53EA59D,Artículo científico.   ? Rodríguez-Espejel  K.  Pérez-Bueno  J. J.  Magdaleno-López  C.  Mendoza-López  M. L.  Algara-Siller  M.  Reyes-Araiza  J. L.  Manzano-Ramírez  A. y Morales-Hernández  J. 2022. Geopolymeric composite materials made of sol-gel silica
1494,9FEF-FEB0A53EA59D,Artículo científico.  Morales Jasso  G.  Benítez Ramírez  D. M.  Romero Contreras  S.  Diédhiou  I.  Velázquez Delgado  G.  Castillo López  G.  Mendoza Pérez  K.  Algara Siller  M. y Olivares Iliana  V. 2022. Multi  inter y transdisciplina  aportes para un
1495,9FEF-FEB0A53EA59D,Artículo científico.   ? Rosa A. Martínez Esquivel  Mariana García de la Torre  José S. Fernández Reyes  Marcos Algara Siller  Claudia Corpus Espinosa  Denisse L. González Villacis  Nancy L. Pérez Ramos  Verne J. Martínez Guzmán  Gerardo Morales Jasso  Xim
1496,B5AB-202D985E099D,Tesis de Maestría. Estudio de las propiedades fisicoquímicas del tomate cherry deshidratado por medio de energía solar térmica. Agosto 2023
1497,B5AB-202D985E099D,Patente MX/a/2022/003106  DISPOSITIVO CONCENTRADOR SOLAR CON ESPEJO DE ARCO CIRCULAR  ASIMÉTRICO  marzo 2022
1498,B5AB-202D985E099D,Articulo. Aprendizaje de las ciencias: Secado de alimentos como proyecto STEM  diciembre 2023  10.20983/culcyt.2023.3.2e.5  Revista CULCYT. Cultura Científica y Tecnológica
1499,B5AB-202D985E099D,Articulo en Congreso XLV ANES Semana Nacional de Energía Solar   SIMULACIÓN ÓPTICA Y TÉRMICA DE UN CONCENTRADOR SOLAR CILÍNDRICO ASIMÉTRICO USANDO EL MÉTODO DE ELEMENTOS FINITOS  octubre 2021
1500,B5AB-202D985E099D,Co-asesora de Tesis: Diseño de un prototipo de un deshidratador solar por intercambio de calor mediante convección  2022
1501,B5AB-202D985E099D,Asesora de Tesis. de Licenciatura  Construcción y Análisis de un deshidratador solar de bajo costo para el proceso de secado de tomate cherry   Universidad Autónoma de San Luis Potosí 2023
1504,B91E-9B0E4E43E39D,"ARTICULO:""Superplastic behavior of Zn-Al eutectoid alloy with 2%Cu""  Mitsuo Ramos Azpeitia  Elizabeth Martinez Flores  Gabriel Torres Villaseñor  Journal of Materials Science 47  pp 6206-6212  2012."
1505,B91E-9B0E4E43E39D,ARTICULO: ?Evaluation of strain caused by coherent precipitates in an Al alloy using TEM techniques?; J.L. Hernández-Rivera  J.J. Cruz Rivera  C.G. Garay-Reyes  M. Ramos Azpeitia  I. Zúñiga-Alonso  R. Martínez-Sánchez. Materials Characterization  Volume 73
1506,B91E-9B0E4E43E39D,ARTICULO: ?Revisión de los modelos para mecanismos de deformación superplástica en aleaciones metálicas?; Mitsuo Osvaldo Ramos Azpeitia. Revista Metalúrgica No. 38  p 16-24. 2016
1507,B91E-9B0E4E43E39D,ARTICULO: ?Analysis of Plastic Flow Instability During Superplastic Deformation of the Zn-Al Eutectoid Alloy Modified with 2 wt.% of Cu?. M. Ramos  E. E. Martinez  J. L. Hernandez  G. Torres-Villaseñor  Materials Engineering and Performance Vol. 26(11)  pp
1508,B91E-9B0E4E43E39D,ARTICULO: ?Evaluación de la nanodeformación causadas por partículas incoherentes en un material compuesto base aluminio?. J. L. Hernández-Rivera  M. Ramos-Azpeitia  J. J. Cruz Rivera  J. Palmerin Moreno  C. G. Garay-Reyes; Acta Microscópica Vol. 27 No1  p 
1509,B91E-9B0E4E43E39D,ARTICULO: ?Former beta boundaries characterization in the superplastic microstructure of a Zn-Al eutectoid alloy modified with 2%wt of Cu?  M. Ramos  E. E. Martinez  J. L. Hernandez  G. Torres-Villaseñor  Acta Microscópica Vol. 27 No1  p 23-28  2018.
1510,B91E-9B0E4E43E39D,ARTICULO:?Microstructural development and mechanical properties during hot rolling and annealing of an automotive steel combining TRIP/TWIP effects?  E.D. Palma- Elvira  P. Garnica-Gonzalez  J.S. Pacheco-Cedeno  J.J. Cruz Rivera  M. Ramos-Azpeitia  C.G. Ga
1511,B91E-9B0E4E43E39D,ARTICULO: ?Casting and Constitutive Hot Flow Behavior of Medium-Mn Automotive Steel with Nb as Microalloying?  Perla Julieta Cerda Vázquez  José Sergio Pacheco-Cedeño  Mitsuo Osvaldo Ramos-Azpeitia  Pedro Garnica González  Vicente Garibay-Febles  Joel More
1512,B91E-9B0E4E43E39D,ARTICULO:?Synergy effects in the fatigue crack growth of hole cold expanded specimens under variable cyclic loading?  R.R. Ambriz  C. García  S.L. Rodríguez-Reyna  M. Ramos-Azpeitia  D. Jaramillo  Intenational Journal of Fatigue  140  2020.
1513,B91E-9B0E4E43E39D,ARTICULO: ?Microstructural changes in a Zn?Al eutectoid alloy modified with 2 wt.% Cu after superplastic deformation?  M. Ramos  E. E. Martinez  J. L. Hernandez  G. Torres-Villaseñor  Journal of Materials Research and Technology  9(3)  5610-5618  2020
1516,B91E-9B0E4E43E39D,ARTICULO: ?Casting and Constitutive Hot Flow Behavior of Medium-Mn Automotive Steel with Nb as Microalloying?  Perla Julieta Cerda Vázquez  José Sergio Pacheco-Cedeño  Mitsuo Osvaldo Ramos-Azpeitia  Pedro Garnica González  Vicente Garibay-Febles  Joel More
1517,B91E-9B0E4E43E39D,ARTICULO: ?Heat treatment optimization of CA-6NM cast alloy using a full factorial design of experiments approach?  M. Ramos-Azpeitia  J. A. Ruiz-Ochoa  J. L. Hernandez-Rivera & C. A. Perez-Alonso  International Journal of Metalcasting  2021. 
1518,B91E-9B0E4E43E39D,ARTICULO: ?3D-FEM Simulation of Hot Rolling Process and Characterization of the Resultant Microstructure of a Light-Weight Mn Steel?; Ana Claudia González-Castillo  José de Jesús Cruz-Rivera  Mitsuo Osvaldo Ramos-Azpeitia  Pedro Garnica-González  Carlos Ga
1519,B91E-9B0E4E43E39D,ARTICULO:?Development of a novel heat-resistant austenitic cast steel with an improved thermal fatigue resistance?  B.A Martinez Carreon  M.O Ramos Azpeitia  J.L Hernandez Rivera  A. Bedolla Jacuinde  C.J. Garcia Lopez  J.A. Ruiz Ochoa y A.C. Gonzalez Cast
1520,B91E-9B0E4E43E39D,ARTICULO: ?Effect of the intercritical annealing in the formability and microstructure of a medium Mn steel sheet?; J.L Hernandez Rivera  A.C. Gonzalez Castillo  M.O. Ramos Azpetia  C.G. Garay Reyes. IOP Conf. Series: Materials Science and Engineering 1284
1521,B91E-9B0E4E43E39D,"ARTICULO: ""Phenomenological Model for the Dynamic Superplastic Deformation  Mechanism in a Zn-Al Eutectoid Alloy Modified with 2 wt% Cu""  Mitsuo Ramos Azpeitia  E. Elizabeth Martínez Flores  Antonio Alberto Torres Castillo  Jose Luis Hernandez Rivera  Gabr"
1522,B84F-623D2FFF368E,M.F. Ramírez-Ayala  A. Lobo Guerrero  A.M. Herrera-González  T.J. Pérez-Juache  R. López-Juárez  J.T. Elizalde Galindo  V.E. Salazar-Muñoz  S.A. Palomares-Sánchez  & S.Y. Reyes-López. Study of neodymium addition on the magnetic and structural properties of
1523,B84F-623D2FFF368E,F. Hernández Navarro  E. Gutiérrez Castañeda  V.E. Salazar Muñoz  A. Bedolla Jacuinde  R. Deaquino Lara  A. Salinas Rodríguez  & P. Zambrano Robledo (2023). Influence of chemical composition and processing conditions on the microstructure and magnetic prop
1524,B84F-623D2FFF368E,M.F. Ramírez Ayala  A.M. Herrera-González  T.J. Pérez-Juache  V.E. Salazar-Muñoz  D. Espericueta  J.G. Cabal Velarde  J.H. García-Gallegos  & A. Lobo-Guerrero (2023). Photocatalytic activity of visible light active Sr hexaferrite prepared by solid-state re
1525,B84F-623D2FFF368E,Verónica Elvira Salazar-Muñoz*  Diana Leticia Espericueta-Gonzalez  Jose Francisco Ibarra-Sánchez  & María Magdalena Montsserrat Contreras. Análisis de aleaciones comerciales en la fabricación de rines de la industria automotriz. Rev. Ingeniantes 2022 Año 
1526,B84F-623D2FFF368E,M.A. Urbano-Peña  V.E. Salazar-Muñoz  S.A. Palomares-Sánchez  V.D. Compean-García  I. Betancourt  C. Butrón-Téllez Girón  F. Ruiz  Optimization of magnetic properties: Investigating the interaction of synthesis temperature  particle size  and monodomain fo
1527,B84F-623D2FFF368E,V.E. Salazar-Muñoz*  C.I. Nolasco  I. Kado-Mercado Elías  & L.C. Martínez Montalvo. Propuesta de selección de materiales basada en Granta Edupack 2020. Rev. Soc. Acad. 58  14-20 (2021). https://www.itson.mx/publicaciones/sociedad-academica/Documents/LSA%20
1528,B84F-623D2FFF368E,V.E. Salazar-Muñoz*  I. Kado Mercado-Elías  & O.M. Noriega-Navarro. Estrategia Autodidacta para Seleccionar Materiales de Ingeniería utilizando Granta-Edupack. ANFEI digital No. 13 (2021). https://www.anfei.mx/revista/index.php/revista/article/view/703
1529,B84F-623D2FFF368E,V.E. Salazar-Muñoz*  I. Kado-Mercado Elías  & D.L. Espericueta-González. CES-Edupack en el proceso de vinculación de los estudiantes de Ingeniería con el sector productivo. ANFEI digital No. 12 (2019). https://www.anfei.mx/revista/index.php/revista/article
1530,B84F-623D2FFF368E,V.E. Salazar-Muñoz*  I. Kado Mercado-Elías  J. Kado Mercado-Elías  & E. Caldiño-Merida. Análisis de la Evaluación de competencias a distancia utilizando Classmarker. ANFEI digital No. 13 (2021). https://www.anfei.mx/revista/index.php/revista/article/view/7
1531,AC0C-96144F0179CC,13. Laura Alejandra Pinedo-Torres  Adrián Bonilla-Petriciolet  María Elena García-Arreola  Yenetzi Villagrana-Pacheco 1 Ana G. Castañeda-Miranda 4and María Selene Berber-Mendoza. 2023 . Adsorption of Arsenic  Lead  Cadmium  and Chromium Ions from Aqueous S
1532,AC0C-96144F0179CC,11. A. Acosta-Rangel   M. Sanchez-Polo  M. Rozalen   J. Rivera-Utrilla  A.M.S. Polo  M.S. Berber-Mendoza  M.V. Lopez-Ramon  2020. Oxidation of sulfonamides by ferrate (VI): Reaction kinetics  transformation by products and toxicity assessment  Journal of E
1533,AC0C-96144F0179CC,1. Flores-Rojas  A.I.  Medellín-Castillo  N.A.  Cisneros-Ontiveros  H.G.  ?  Berber-Mendoza  M.S.  Díaz-Flores  P  et al. 2023. Detection and mapping of the seasonal distribution of water hyacinth (Eichhornia crassipes) and valorization as a biosorbent of 
1534,AC0C-96144F0179CC,"Tesis doctorado "" ELIMINACIÓN DE ANIONES MEDIANTE ADSORCIÓN SOBRE ÓXIDOS DE HIERRO MODIFICADOS Y PROCESOS AVANZADOS DE OXIDACIÓN PARA LA DEGRADACIÓN DE FÁRMACOS""  Alumna Aurora Acosta Rangel  septiembre 2019."
1535,AC0C-96144F0179CC,"Tesis doctorado ""Síntesis y modificación química de materiales Adsorbentes para la eliminación de contaminantes en el agua"". Sonia Judith Segovia Sandoval  ocutbre 2019"
1536,AC0C-96144F0179CC,15. Urbano-Peña  M.A.  Berber-Mendoza  M.S.  Palomares-Sánchez  S.A.  Gutiérrez-Castañeda  E.J.  Hurtado-López  G.F. 2024. Magnetic compounds based on strontium hexaferrite for the adsorption of lead in contaminated water. Ceramics International  50(9)  14
1537,BF99-069AB1B1876E,Loredo-Tovías  M.  Alcalá-Jáuregui  J. A.  García-Arreola  M. E.  Carballo-Méndez  F. D. J.  Rodríguez-Fuentes  H.  Buendía-García  A.  & Rodríguez-Ortiz  J. C. (2022). Concentración y transferencia de metales pesados en lechuga (Lactuca sativa L.) irrigad
1538,9CFE-09DE3823CB82,"Artículo científico  titulado ""Insights into the plumbing system of Colima Volcanic Complex from  geophysical evidence"" como primer autor en 2023"
1539,9CFE-09DE3823CB82,"Artículo científico titulado ""Geophysical determination of the Jalisco and Michoac´an blocks boundaries  along the Colima Graben"" como primer autor en 2021"
1540,9CFE-09DE3823CB82,"Artícullo científico titulado ""An integrated geophysical and geological 3D model to characterize the  feeder system of La Joya Honda and La Joyuela maars complex in  central Mexico"" como autor correspondiente en 2023"
1541,9CFE-09DE3823CB82,"Publicación de artíuclo científico titulado ""Voluminous Paleogene volcanism in the southern Mesa Central  Mexico: Unravelling the fissure-fed origin of rhyolitic ignimbrites of the Villa  Garcia-Loreto Volcanic Complex"" como coautor en 2021"
1542,9CFE-09DE3823CB82,"Publicación de artículo titulado ""Characterization of a fractured aquifer through potential geophysics  and physicochemical parameters of groundwater samples"" como coautor en el 2020"
