503,9F70-631542E15748,Publicación científica con arbitraje  Facundo-Ponce  A.  y Noyola-Medrano  C. (2019). Detección de la cobertura de sargazo en la zona de Quintana Roo mediante técnicas de Percepción Remota. En Noyola-Medrano et al.  (Eds). Aproximaciones Tecnológicas de Va
504,9F70-631542E15748,Publicación científica con arbitraje  Guerrero-González  V.  y Noyola-Medrano  C. (2019). Análisis de las islas de calor en el área urbana de San Luis Potosí utilizando imágenes satelitales. En Noyola-Medrano et al.  (Eds). Aproximaciones Tecnológicas de V
505,9F70-631542E15748,Publicación en revista indexada  Noyola-Medrano  C.  Ramos-Leal  J.A.  López-Alvarez  B.  Moran-Ramírez  J. & Fuentes-Rivas  R.M. (2019). Assessing the source and spatial distribution of chemical composition of a rift lake  using multivariate statistical a
506,9F70-631542E15748,Publicación en revista indexada  Piza-Davila  I.  Sanchez-Diaz  G.  Lazo-Cortes  M. S.  & Noyola-Medrano  C. (2018). Enhancing the performance of YYC algorithm useful to generate irreducible testors. International Journal of Pattern Recognition and Artific
507,9F70-631542E15748,Publicación en revista indexada  Gaytán-Martínez  R.  Noyola-Medrano  C.  Rojas-Beltrán  M.A. (2017). Análisis espectral y petrográfico del Complejo Volcánico Sierra de San Miguelito  S.L.P. México. Serie Correlación Geológica  33(1-2): 49-60. http://www.i
508,9F70-631542E15748,Publicación en revista indexada  Noyola-Medrano C.  Martínez-Sías  V.A. 2017. Assessing the progress of desertification of the Southern Edge of Chihuahuan Desert. Case study: San Luis Potosi Plateau. Journal of Geographical Sciences  27(4): 420-438. https:
509,9F70-631542E15748,Publicación en revista indexada  Rodríguez-Hernández  A.  Briones-Gallardo  R.  Razo  I.  Noyola-Medrano  C.  Lázaro  I. 2016. JRS Processing methodology based on ASTER data for mapping mine waste dumps in a semiarid polysulfide mine district. Canadian Jou
510,9F70-631542E15748,Editora principal del libro;  Noyola-Medrano  C.  Reyes-Cárdenas  O.  Aguirre-Salado  C.  y Cárdenas-Tristán  A. (2019). Aproximaciones Tecnológicas de Vanguardia en la Geomática  Geodesia y Geoinformática en México. Universidad Autónoma de San Luis Potosí
511,8B90-DF6C040A0CD5,Nuclear Instruments & Methods B. Pixe Analysis of Atmospheric Aerosols from Three Sites in Mexico City  (2004)
512,8B90-DF6C040A0CD5,PIXE ANALYSIS OF ATMOSPHERIC AEROSOLS RELATED TO THEIR CYTOTOXIC AND GENOTOXICS EFFECTS. Proceedings of the 10th International Conference on Particle Induced X-Ray Emission and its Analyttical Applications  (2004)
513,8B90-DF6C040A0CD5,PIXE ANALYSIS OF ATMOSPHERIC AEROSOLS IN MEXICO CITY  X-Ray Spectometry  (2005)
514,8B90-DF6C040A0CD5,CONTRIBUTION OF SOIL  SULFATE  AND BIOMASS BURNING SOURCES TO THE ELEMENTAL COMPOSITION OF PM10 FROM MEXICO CITY. ISSN: 1735-6865. International Journal of Environmental Research  (2012)
515,8B90-DF6C040A0CD5,FACTOR DE EMISIÓN DE AEROSOLES DE CN  CO2 Y CO PROVENIENTES DE LA QUEMA DE CAÑA DE AZUCAR.  SIMPOSION INTERNACIONAL  CONGRESO NACIONAL DE AGRICULTURA SOSTENIBLE  (2014)
516,8B90-DF6C040A0CD5,Study of air pollution in the proximity of a waste incinerator. Nuclear Instruments and Methods in Physics Research B. (2015)
517,8B90-DF6C040A0CD5,BACKGROUND CONSIDERATIONS IN THE ANALYSIS OF PIXE SPECTRA BY ARTIFICIAL NEURAL SYSTEMS. JOURNAL OF PHYSICS  (2016)
518,8B90-DF6C040A0CD5,Water-soluble inorganic ions of size-differentiated atmospheric particles from a suburban site of Mexico City. J. Atmos Chem  (2017)
519,8B90-DF6C040A0CD5,Combined use of daily and hourly data sets for the source apportionment of particulate matter near a waste incinerator plant  ENVIRONMENTAL POLLUTION  (2019)
520,8B90-DF6C040A0CD5,ATMOSPHERIC BLACK CARBON CONCENTRATIONS IN MEXICO  Atmospheric Reasearch  (2019)
521,9CD4-C3F1E58742DD,Articulo de en revisa Indexada: Study of the Effect of the Mineral Feed Size Distribution on a Ball Mill Using Mathematical Modeling (2021). Mineral Processing Journal.
522,9CD4-C3F1E58742DD,Articulo en Revista Indexada: Study of lifter wear and breakage rates for different lifter geometries in tumbling mill: Experimental and simulation analysis using population balance model (2019). Delgadillo y Col. Minerarlas Engineering.
523,9CD4-C3F1E58742DD,Articulo en Revista Arbitrada: Evaluación del rendimiento de la molienda por compresión de partículas y molienda de bolas para procesamiento de menas de cobre usando el Modelo de Balance Poblacional. (2018). Delgadillo y Col. Revista Metalúrgica.
525,9CD4-C3F1E58742DD,Articulo en Revista indexada: Effect of microwave pretreatment on grinding of Iron ore ISSN: 0970-7077 (2017). Delgadillo y Col.  Asian Journal of Chemistry
527,9CD4-C3F1E58742DD,Articulo en Revista indexada: Analysis and validation of the hydrodynamics of an electrodialysis cell  using computational fluid dynamics. 2017. Delgadillo y Col. Desalination.
528,9CD4-C3F1E58742DD,Articulo en revista Indexada: Effect of gas superficial velocity (Jg) and frother/collector (MIBC/X-343)  reagent dosage on froth horizontal displacement and galena drainage. 2017. Delgadillo y Col. Minerales Engineering
529,9CD4-C3F1E58742DD,Articulo en Revista Indexada: Prediction of a piston?die press product using batch population balance model. 2016. Asian-Pacific Journal of Chemical Engineering
530,A57D-3A05F840F619,Flores-Flores  J.L.  E. García-Moya y E.A. Ortega-Martínez. 2019. Pastizal o zacatal. En: La biodiversidad en San Luis Potosí. Estudio de Estado. Vol. II. CONABIO  México  pp. 67-71.
531,A57D-3A05F840F619,Ramírez A.  J.E.; E. Badano; J. Flores; J.L. Flores F.; L. Yáñez E. 2019. Scientific literature on invasive alien species in a megadiverse country: advances and challenges in Mexico. NeoBiota 48: 113-127.
532,8F89-F58A927A68DD,Autor de la ponencia CES-EDUPACK EN EL PROCESO DE VINCULACION DE LOS ESTUDIANTES DE INGENIERIA CON EL SECTOR PRODUCTIVO; presentado en el marco de la XLVII Conferencia Nacional de Ingeniería. 6 de noviembre del 2020
533,A57D-3A05F840F619,López-Palacios  L.M.; J. Fortanelli Martínez  J.L. Flores-Flores  y J. García-Pérez. 2018. Análisis de la cobertura vegetal en el gradiente topográfico del cráter la joya honda San Luis Potosí. Polibotánica 46: 117-135.
534,A57D-3A05F840F619,Záhora  J. P. Nájera Quezada  J.L. Flores Flores  y J. Morales. 2018. Echinofossulocactus or Stenocactus. The Cactus Explorer  VII (1) 24: 43-58.
535,A57D-3A05F840F619,Errejón Gómez  J. C.  Flores Flores  J. L.  Muñoz Robles  C. A.  & Reyes Hernández  H. (2017). Las políticas forestales en el estado de San Luis Potosí en el porfiriato. Región y sociedad  29(69)  219-248.
536,A57D-3A05F840F619,Záhora  J. P. Najera Quezada  J.L. Flores Flores  A. Pascalín Colín and J. Ríha 2017. Field observations and threatening environmental factors of Echinofolocactus sulphureus (Dietr.) Meyrán. The Cactus Explorer  18: 61?74.
537,A57D-3A05F840F619,Záhora  J. P. Najera Quezada  J.L. Flores Flores  A. Pascalín Colín and J. Ríha 2017. Field observations and threatening environmental factors of Echinofolocactus sulphureus (Dietr.) Meyrán. The Cactus Explorer  18: 61?74.
538,A57D-3A05F840F619,Badano E.I.  O.R. Samour-Nieva  J. Flores  J.L. Flores-Flores  J.A. Flores-Cano & J.P. Rodas Ortiz. 2016. Facilitation by nurse plants contributes to vegetation recovery in human-disturbed desert ecosystems. J. Plant Ecol.  9(5): 485-497.
539,A57D-3A05F840F619,Rodriguez-Hernandez  M.C.  I. Bonifas  M.C. Alfaro-De la Torre  J.L. Flores-Flores  B. Bañuelos-Hernández  O. Patiño-Rodríguez. 2015. Increased accumulation of cadmium and lead under Ca and Fe deficiency in Typha latifolia: A study of two pore channel (TPC
540,A57D-3A05F840F619,María Lina Fuentes-Galván  M.L.  X. Delgado-Galván  H. Charcas-Salazar  J. Mora-Rodríguez  J. L. Flores Flores and A. Cardona Benavides. 2015. Rooftop rainwater harvesting acceptance in three localities of Guanajuato  central Mexico. Interciencia  40(6): 4
541,B579-BDC7A118DF08,E Galarza.  H.Reyes.  G.Palacio. 2017. Percepción Remota e instumentos cualitativos para evaluar el aprovechamiento maderable del mezquital en la llanura de rioverde  San Luis Potosí. En Reyes-Hernández  H.  Moreira-Beita  C. Reyes-Pérez  O Geografía Ambie
542,B579-BDC7A118DF08,H.Reyes.  E.Galarza. 2017. Procesos de recuperación y restauración del bosque de niebla en la RPC Xilitla  San Luis Potosí  México En ?Análisis y modelación de patrones y procesos de cambio  2017  CIGA  CONACYT.
543,B579-BDC7A118DF08,D.Solís.  E.Galarza. 2017. Análisis cuantitativo de la discriminación  exclusión y violencia. En Procesos educativos en contextos de desigualdad  discriminación  exclusión y violencia. Ed. Fontamara  7-125.
544,B579-BDC7A118DF08,Contribución cartográfica en: Y. Hernández-Fuentes y A. Betancourt-Mendieta.2015. Agua y abastecimiento: gestión de cuerpos de agua en la ciudad de San Luis Potosí  México  1831-1887. Historelo  60.98.
547,961E-D1D3CBCC7E87,Alumna titulada. Rosalie Irais Rangel Vázquez. Tema: Estudio hidrológico y geofísico en la zona del acuífero Silao-Romita del estado de Guanajuato. 
548,961E-D1D3CBCC7E87,Alumna titulada. Karla Rubí Juárez Morales. Tema: Análisis Magnético como herramienta para la definición de diques piroclásticos de la Ignimbrita Panalillo inferior de la Sierra de San Miguelito  San Luis Potosí. Asesoría externa: Benemérita Universidad Au
549,961E-D1D3CBCC7E87,Articulo científico. Guevara  R.  Yutsis  V.  Varley  N.  Almaguer  J.  Calderón-Moctezuma  A.  & Guevara-Mansilla  O. (2021). Geophysical determination of the Jalisco and Michoacán blocks boundaries along the Colima Graben. Journal of South American Earth
550,961E-D1D3CBCC7E87,Articulo científico. Sieck  P.  Dávila-Harris  P.  López-Doncel  R. A.  Almaguer  J.  Aguillón-Robles  A.  Wemmer  K.  & Guevara  R. (2021). Voluminous Paleogene volcanism in the southern Mesa Central  Mexico: Unravelling the fissure-fed origin of rhyoliti
577,9F2E-690464EFFA85,Trabajo Recepcional: ?Selección de geositios en el parque ecoturístico de Boca de Túnel de Potrerillos  San José de Gracia  Ags.?. Ruvalcaba Pérez Andrés Emiliano. Universidad Autónoma de San Luis Potosí  Facultad de Ingeniería. Área Ciencias de la Tierra.
578,9F2E-690464EFFA85,Trabajo Recepcional: ?Interpretación geológica y petrográfica a partir de barrenacion a diamante  en el área de Membrillo  Distrito Minero de Charcas?. Ventura Ortega Diego Guadalupe. Universidad Autónoma de San Luis Potosí  Facultad de Ingeniería. Área Ci
579,9F2E-690464EFFA85,Trabajo Recepcional: ?Sistematización y catalogación de una colección mineralógica y litológica para el Colegio de Postgraduados  Campus San Luis?. Badillo Leyva Jessica Elizabeth. Universidad Autónoma de San Luis Potosí  Facultad de Ingeniería. Área Cienc
580,9F2E-690464EFFA85,Tesis: ?Caracterización geológica  mineralógica y gemológica de los topacios de la localidad ?El Tepetate?  Villa de Arriaga  San Luis Potosí?. Ruiz Sánchez Miriam. Universidad Autónoma de San Luis Potosí  Facultad de Ingeniería. Área Ciencias de la Tierra
581,9F2E-690464EFFA85,Tesis: ?Aplicación de la teledetección para la localización y caracterización de materias primas en la zona occidental de Aguascalientes?. Avalos Capetillo Gustavo. Universidad Autónoma de San Luis Potosí  Facultad de Ciencias Sociales y Humanidades. Progr
582,9F2E-690464EFFA85,Tesis: ?Geología  Petrografía y Geoquímica de las rocas intrusivas de la Tomatina  Estado de Aguascalientes?. Hernández Betsara Alejandra. Universidad Autónoma de San Luis Potosí  Facultad de Ingeniería. Área Ciencias de la Tierra. Programa de Ingeniería e
583,9F2E-690464EFFA85,Trabajo Recepcional: ?Caracterización Óptica  Química y Espectral del Larimar  Mineral de Republica Dominicana?. Centeno Herrera Jorge Luis. Universidad Autónoma de San Luis Potosí  Facultad de Ingeniería. Área Ciencias de la Tierra. Programa de Ingeniería
584,9F2E-690464EFFA85,Trabajo Recepcional: ?Cuantificación espacial del impacto ambiental generado por la Arenera La Palma y el tajo de Cerro de San Pedro  S.L.P.?. Narváez Juárez Irma Gabriela. Universidad Autónoma de San Luis Potosí  Facultad de Ingeniería. Área Ciencias de l
585,9F2E-690464EFFA85,Articulo de Divulgación. Oscar Elías González Salas  Marco Antonio Rojas Beltrán  y Martha Yolanda Meléndez Oviedo. 2019. El fascinante paisaje kárstico: La gruta La Puente. Universitarios Potosinos  Revista de Divulgación Científica. ISSN-1870-1698. Año 1
586,9F2E-690464EFFA85,Resumen in extenso en Memorias de Congreso. Duarte Pérez Olivia  Noyola Medrano Cristina y Rojas Beltrán Marco Antonio. 2019. Cartografía geológica a partir del análisis de la vegetación con percepción remota para la Republica Dominicana. Aproximaciones Te
587,9F2E-690464EFFA85,Resumen in extenso en Memorias de Congreso. Avalos Capetillo Gustavo  Lailson Tinoco Becket  Rojas Beltrán Marco Antonio y Pérez Roldán Gilberto. 2019. Aplicación de la teledetección para la localización de materias primas en la zona occidental de Aguascal
588,9F2E-690464EFFA85,Resumen in extenso en Memorias de Congreso. Centeno Herrera Jorge Luis  Rojas Beltrán Marco Antonio  y Noyola Medrano Cristina. 2019. Reporte preliminar de las características ópticas  químicas y espectrales del Larimar  mineral emblemático de la República
589,9F2E-690464EFFA85,Resumen in extenso en Memorias de Congreso. Narváez Juárez Irma Gabriela y Rojas Beltrán Marco Antonio. 2019. El uso de Google Earth para cuantificar el área de impacto ambiental de la mina de Cerro de San Pedro  S.L.P. Aproximaciones Tecnológicas de Vangu
590,9F2E-690464EFFA85,Resumen in extenso en Memorias de Congreso. Andrade González David  Rojas Beltrán Marco Antonio  Noyola Medrano Cristina y Lailson Tinoco Becket. 2019. Exploración geoarqueológica a través de la percepción remota. Aplicación en el Cerro El Almagre  Tierra 
591,9F2E-690464EFFA85,Resumen in extenso en Memorias de Congreso. Cruz Jiménez Marcos Benjamín  Rojas Beltrán Marco Antonio  Lailson Tinoco Becket  y Avalos Capetillo Gustavo. 2019. Actualización cartográfica digital del yacimiento arqueológico de Palo Alto  Ags. Aproximaciones
592,9F2E-690464EFFA85,Resumen in extenso en Memorias de Congreso. Robles Gorjón Carlos Alberto  Rojas Beltrán Marco Antonio y Noyola Medrano Cristina.  2019. Cartografía y volumetría del volcán Los Encinos  Villa Hidalgo  S.L.P. Aproximaciones Tecnológicas de Vanguardia en la G
593,9F2E-690464EFFA85,Trabajo por Excelencia: ?Registro de patente y modelo industrial en México  de un instrumento para la toma de datos geológicos?. García Sánchez Gerardo Daniel. Universidad Autónoma de San Luis Potosí  Facultad de Ingeniería. Área Ciencias de la Tierra. Pro
594,9F2E-690464EFFA85,Trabajo Recepcional: ?Clasificación megascópica y microscópica de la colección de rocas metamórficas para el laboratorio de petrografía?. Luna Martínez Miguel Armando. Universidad Autónoma de San Luis Potosí  Facultad de Ingeniería. Área Ciencias de la Tie
595,9F2E-690464EFFA85,Trabajo Recepcional: ?Cartografía geológica de superficie y evidencia de afectaciones en obras civiles  ocasionadas por la falla Buenavista  Soledad de Graciano Sánchez  S.L.P.?. Almonacid Castañeda Martín de Jesús. Universidad Autónoma de San Luis Potosí 
596,9F2E-690464EFFA85,Trabajo Recepcional: ?Caracterización  zoneamiento y paragénesis de la veta Amolillo en el yacimiento La Colorada  Chalchihuites  Zacatecas?. Cepeda Gómez Shaí Anllelyd. Universidad Autónoma de San Luis Potosí  Facultad de Ingeniería. Área Ciencias de la T
597,9F2E-690464EFFA85,Tesis: ?Geología y estratigrafía volcánica del yacimiento arqueológico de Palo Alto  Aguascalientes?. Cruz Jiménez Marcos Benjamín. Universidad Autónoma de San Luis Potosí  Facultad de Ingeniería. Área Ciencias de la Tierra. Programa de Ingeniería en Geolo
598,9F2E-690464EFFA85,Tesis: ?Cartografía digital y fotogrametría de alta resolución a través del uso de drones  aplicada al volcán Los Encinos  Villa Hidalgo  S.L.P.? Robles Gorjón Carlos Alberto. Universidad Autónoma de San Luis Potosí  Facultad de Ingeniería. Área Ciencias d
599,9F2E-690464EFFA85,Trabajo Recepcional: ?Geoarqueología y exploración de anomalías hidrotermales a través de la percepción remota. Caso de estudio: Cerro El Almagre  Tierra Nueva  S.L.P?. Andrade González David. Universidad Autónoma de San Luis Potosí  Facultad de Ingeniería
600,9F2E-690464EFFA85,Trabajo Recepcional: ?Mineralogía y Mineragrafía de algunas minas Mexicanas productoras de metales base y preciosos?. Martínez Robles Luis Fernando. Universidad Autónoma de San Luis Potosí  Facultad de Ingeniería. Área Ciencias de la Tierra. Programa de In
601,9F2E-690464EFFA85,Trabajo de Excelencia: ?Análisis espectral de la litología de la porción norte de la Sierra de San Miguelito  S.L.P.?. Gaytán Martínez Rafael. Universidad Autónoma de San Luis Potosí  Facultad de Ingeniería. Área Civil. Programa de Ingeniería en Geomática.
603,9F2E-690464EFFA85,Articulo de investigación. Rafael GAYTAN-MARTINEZ  Cristina NOYOLA-MEDRANO y Marco Antonio ROJAS-BELTRAN. 2017. ?Análisis espectral y petrográfico del Complejo Volcánico Sierra de San Miguelito  S.L.P.  México?. Serie Correlación Geológica  Vol. 33  Nos. 1
631,96BA-EB25A6DA1F69, Isidro Montes-Avila  Erik Espinosa-Serrano  Javier Castro-Larragoitia  Antonio Cardona  Isabel Lázaro. Chemical  mobility of inorganic elements in stream sediments of a semiarid zone impacted by ancient mine residues. Applied  Geochemistry 100 (2019) 8?21
632,96BA-EB25A6DA1F69,Javier Castro-Larragoitia  Ofelia Morton-Bermea  Rebeca Jazmín Pérez-Rodríguez  Israel Razo-Soto  Isidro  Montes-Ávila  Elizabeth Hernández-Álvarez  Ángel Alberto Arellano-Álvarez  2020. Antimony  cadmium and  other trace metals in blood from children expo
633,96BA-EB25A6DA1F69,"Ofelia Morton-Bermea; Elizabeth Hernández-Alvarez; Sara Laura Ordoñez-Godínez; Isidro Montes-Ávila  ""Mercury  platinum  antimony and other trace elements contamination in urban areas of Mexico City: Use of Ficus  benjamina as biomonitor""  submission in Bul"
634,96BA-EB25A6DA1F69,Montes-Avila I.  Cardona- Benavides A.  Lazro.Baez I.  Razo-soto I.  y  Hernández-Ruiz s. Spatial distribution of  arsenic and lead in stream sediments in a micro-basin with ancient mining activities. I2SM Chiapas  México 2018.  Revista Internacional de Co
635,96BA-EB25A6DA1F69,Juan Carlos Burillo  Antonio Cardona  Javier Castro-Larragoitia  Isidro Montes. Caracterización y modelación  hidrogeoquímica de lixiviados mineros de San Luis Potosí  S.L.P. México. Bol. Soc. Geol. Mex. 2017  vol. 69 no.  3  p. 637 ? 654. http://dx.doi.or
645,B2B9-C9CB95F55072,"Mendoza-Rojas  Ll. M.   2024 "" Cartografía geológico-estructural del área Pregrina de Abajo y sus alrededores  municipio de Santa María del Río  escala 1:20 000"" TESIS  UASLP  44 p.(ASESOR)"
646,B2B9-C9CB95F55072,"Alcaraz-Mercado  A.  2024 ""Evolución estructural en el Complejo Volcánico Santa María y la Plataforma Valles-San Luis Potosí"" TESIS  UASLP  78 p.(COASESOR)"
647,8B07-A4FEB5EE43AD,  2021-Asesor de Memorias de Actividad Profesional ?Caracterización Geológica de la Secuencia Volcánica en la Unidad Minera Bolaños  mina El Alacrán  Municipio de Bolaños Jalisco?
648,8B07-A4FEB5EE43AD,2021-Asesor de Memorias de Actividad Profesional ?Refuerzo Geotécnico con Barras de Acero en la Mina Guadalupe  complejo Palmarejo- Guadalupe localidad de Palmarejo  Municipio de Chínipas  Chihuahua?
649,8B07-A4FEB5EE43AD,2020- Asesor de Memorias de Actividad Profesional ?Producción Histórica y potencial de la Veta Santa Jessica  en el Distrito Minero de San Dimas  Durango?
650,8B07-A4FEB5EE43AD,2016- Asesor del Trabajo Recepcional ?Correlación Litoestratigráfica Geohidrológica y Geofísica-Eléctrica de la parte Sur Oeste de la delegación de bocas y Valle de Arista  S.L.P.?
651,97B0-E40EC464619C,Modificación del programa de la materia de Geología del Petróleo en el año 2019 la cual está incluida dentro de la Academia de Geología Aplicada 
652,8E44-4CD5A2183D30,Saucedo R  Macías JL  Gómez-Villa W  Rivera-Olguín E  Ocampo-Díaz YZE  Torres-Hernández R  Castro-Govea  R  Sánchez-Núñez  JM  Layer P.  Carrasco-Núñez G. (2017) Mixed magmatic-phreatomagmatic explosions during the formation of the Joya Honda maar  San Lui
653,8E44-4CD5A2183D30,Macías  J.L.  Sosa-Ceballos  G.  Arce  James  J.L.  Gardner  E.  Saucedo  R.  and Valdez  G. (2017) Storage conditions and magma processes triggering the 1818 A.D. Plinian eruption of Volcán de Colima. Journal Volcanology and Geothermal Research V 340  117
654,8E44-4CD5A2183D30,Gacía-Sanchez  L.  Macías  JL.  Arce  JL.  Sosa-Ceballos  G. Garduño-Monroy  VH.  Saucedo  R.  Avellan  D.R.  Rangel  E.  Layer  P.W.  Lopez-Loera  H.  Rocha  V.S.  Cisneros  G.  Reyes-Agustin and G.  Jiménez  A. (2017) Genesis and evolution of the Cerro P
655,8E44-4CD5A2183D30,Sanchez-Nuñez  J.M.  Macías  J.L.  Saucedo  R.  Novelo  D.A.  Zamorano  M. (2017) Caracterización granulométrica de los depósitos de abanicos aluviales de la Cuenca de Motozintla  Chiapas  México: un peligro geológico latente por eventos de inundación. Bol
656,8E44-4CD5A2183D30,Julio Lara Calderón  Juan Gómez Avalos  Juan Sánchez Nuñez  Ricardo Saucedo (2017). Avalanchas de escombros en el complejo volcánico Sillapaca: una herramienta para la gestión sostenible del territorio. Espacio y Desarrollo N° 30  2017  pp. 193-208 (ISSN 1
657,8E44-4CD5A2183D30,Denis Ramón Avellán  José Luis Macías  José Luis Arce  Adrian Jiménez-Haro  Ricardo Saucedo-Girón Víctor Hugo Garduño-Monroy  Giovanni Sosa-Ceballos  Juan Pablo Bernal  Hector López-Loera  Guillermo Cisneros  PaulW. Layer  Laura García-Sánchez  Gabriela Re
658,8E44-4CD5A2183D30,José Luis Macías  José Luis Arce  Lucia Capra  Ricardo Saucedo  and Juan Manuel Sánchez-Núñeze (2018). Late formative flooding of Izapa after aneruption of Tacaná volcano. Ancient Mesoamerica (0956-5361)  v 29  N 2   361?371.
659,8E44-4CD5A2183D30,Vázquez R.  Macías  J.L.  Arce  J.L.  Cisneros  G.  Saucedo  R. (2019) Numerical simulation of block-and-ash flows for different eruptive scenarios of the Tacaná volcanic complex  Mexico-Guatemala. Journal Volcanology and Geothermal Research (issn 0377-027
660,8E44-4CD5A2183D30,Bevilacqua  A.  Bursik  M.  Patyra  A.  Pitman B.  Macías  J.L.  Saucedo  R.  Hyman  D. (2019) Probabilistic forecasting of plausible debris flows from Nevado de Colima (México) using data from the Atenquique debris flow  1955. Nat. Hazards Earth Syst. Sci
661,8E44-4CD5A2183D30,Denis Ramón Avellán  José Luis Macías  José Luis Arce  Adrian Jiménez-Haro  Ricardo Saucedo-Girón Víctor Hugo Garduño-Monroy  Giovanni Sosa-Ceballos  Juan Pablo Bernal  Hector López-Loera  Guillermo Cisneros  PaulW. Layer  Laura García-Sánchez  Gabriela Re
662,8E44-4CD5A2183D30,Saucedo  R.  Macías  J.L.  Gavilanes-Ruiz  J.C.  Bursik  M.I.  and Vargas Gutiérrez  V. (2019). Pyroclastic density currents at Volcán de Colima. Springer-Verlag GmbH Germany  part of Springer Nature 2019 Journal Springer (ISSN 2195-3589). Special publicat
663,8E44-4CD5A2183D30,L. García Sánchez  J.L. Macías  R. Sulpizio  L.S. Osorio-Ocampo  C. Pellicioli  A. Pola  D.R. Avellan  G. Cisneros  F. García  Y.Z.E. Ocampo-Díaz  R.M. Lira-Beltran  Saucedo  R.  J.M. Sánchez-Núñez  J.L. Arce  P. Corona-Chávez  G. Reyes-Agustin  M. Cardona
664,8E44-4CD5A2183D30,Yam Zul Ernesto Ocampo-Díaz  Sonia Alejandra Torres-Sánchez  Carita Augustsson  José Rafael Barboza-Gudiño  José Luis García-Díaz  Oscar Talavera-Mendoza  Jorge Aceves de Alba  Javier Castro-Larragoitia  Margarita Martínez-Paco  Ricardo Saucedo  Alfredo Ag
665,8E44-4CD5A2183D30,Sosa-Ceballos  G.  Macias  J.L.  Avellán  D.R.  Arce  J.L.  Saucedo  R.  Boijseauneau-López  M.  García-Sánchez. L.  Reyes-Agustín  G.  Osorio-Ocampo  S.   (2019) Genesis of magmas from the Tres Vírgenes Volcanic Complex  Baja California Sur. LITHOS 350-35
666,8E44-4CD5A2183D30,Delphine Sourisseaua  José Luis Macías  Felipe García Tenorio  Denis Ramón Avellán  Ricardo Saucedo Girón  Juan Pablo Bernal  José Luis Arce Saldaña  Zareth Tinoco Murillo (2020). New insights into the stratigraphy and 230Th/U geochronology of the post-cal
667,8E44-4CD5A2183D30,Jesús Alcala-Reygosa  José Luis Arce José Luis Macías  Irene Schimmelpfennig  Ricardo Saucedo  Juan Manuel Sánchez  Teodoro Carlon  Rosario Vazquez  Guillermo Cisneros-Maximo  Adrian Jímenez  Salvador Fernandez  ASTER Team. (2021) New chronological constra
668,8E44-4CD5A2183D30,Yam Zul Ernesto Ocampo-Díaza  Giovani Sosa-Ceballos  Ricardo Saucedo  José Luis Macías  Xavier Bolós  Ulises Alejandro Radilla-Albarránd  Margarita Martínez-Paco   Ulises Salinas-Ocampo  Guillermo Cisneros-Máximo. (2021) Provenance and compositional variat
669,8E44-4CD5A2183D30,Andres Sandoval-Velasquez  Andrea Luca Rizzo  Maria Luce Frezzotti  Ricardo Saucedo  Alessandro Aiuppa. (2021) The composition of fluids stored in the central Mexican lithospheric mantle:Inferences from noble gases and CO2 in mantle xenoliths. Chemical Geo
750,A789-29AD6B988B66,Re-diseño del programa de la materia de Hidorología en el año 2019.  Presidente de la Academia de Geología Aplicada desde septiembre de 2020 a la fecha.
751,8124-EC5803EE2762,Manual de Autocad Map  Parte teórica
752,8124-EC5803EE2762,"Manual de practicas de Laboratorio de la materia de Computación Aplicada ""A"""
